"No.","Time","Source","Destination","Protocol","Length","Info"
"378","8.480528","192.168.0.112","187.33.247.110","TCP","66","57963  >  443 [SYN] Seq=0 Win=64240 Len=0 MSS=1460 WS=256 SACK_PERM=1"
"380","8.483650","192.168.0.112","187.33.247.110","TCP","66","57964  >  443 [SYN] Seq=0 Win=64240 Len=0 MSS=1460 WS=256 SACK_PERM=1"
"382","8.498887","187.33.247.110","192.168.0.112","TCP","66","443  >  57963 [SYN, ACK] Seq=0 Ack=1 Win=65535 Len=0 MSS=1440 SACK_PERM=1 WS=256"
"383","8.499107","192.168.0.112","187.33.247.110","TCP","54","57963  >  443 [ACK] Seq=1 Ack=1 Win=132352 Len=0"
"384","8.503940","192.168.0.112","187.33.247.110","TLSv1.3","571","Client Hello"
"385","8.503954","187.33.247.110","192.168.0.112","TCP","66","443  >  57964 [SYN, ACK] Seq=0 Ack=1 Win=65535 Len=0 MSS=1440 SACK_PERM=1 WS=256"
"386","8.504036","192.168.0.112","187.33.247.110","TCP","54","57964  >  443 [ACK] Seq=1 Ack=1 Win=132352 Len=0"
"387","8.509812","192.168.0.112","187.33.247.110","TLSv1.3","571","Client Hello"
"390","8.522972","187.33.247.110","192.168.0.112","TCP","60","443  >  57963 [ACK] Seq=1 Ack=518 Win=66816 Len=0"
"392","8.527688","187.33.247.110","192.168.0.112","TCP","60","443  >  57964 [ACK] Seq=1 Ack=518 Win=66816 Len=0"
"393","8.529148","187.33.247.110","192.168.0.112","TLSv1.3","1494","Server Hello, Change Cipher Spec"
"394","8.530173","187.33.247.110","192.168.0.112","TCP","1494","443  >  57964 [ACK] Seq=1441 Ack=518 Win=66816 Len=1440 [TCP segment of a reassembled PDU]"
"395","8.530173","187.33.247.110","192.168.0.112","TLSv1.3","477","Application Data"
"396","8.530337","192.168.0.112","187.33.247.110","TCP","54","57964  >  443 [ACK] Seq=518 Ack=3304 Win=132352 Len=0"
"397","8.535881","187.33.247.110","192.168.0.112","TLSv1.3","1494","Server Hello, Change Cipher Spec"
"398","8.535881","187.33.247.110","192.168.0.112","TCP","1494","443  >  57963 [ACK] Seq=1441 Ack=518 Win=66816 Len=1440 [TCP segment of a reassembled PDU]"
"399","8.535881","187.33.247.110","192.168.0.112","TLSv1.3","477","Application Data"
"400","8.536055","192.168.0.112","187.33.247.110","TCP","54","57963  >  443 [ACK] Seq=518 Ack=3304 Win=132352 Len=0"
"401","8.538468","192.168.0.112","187.33.247.110","TLSv1.3","118","Change Cipher Spec, Application Data"
"402","8.539323","192.168.0.112","187.33.247.110","TLSv1.3","619","Application Data"
"404","8.545779","192.168.0.112","187.33.247.110","TLSv1.3","118","Change Cipher Spec, Application Data"
"405","8.547115","192.168.0.112","187.33.247.110","TLSv1.3","625","Application Data"
"406","8.559315","187.33.247.110","192.168.0.112","TCP","60","443  >  57964 [ACK] Seq=3304 Ack=1147 Win=67840 Len=0"
"407","8.559315","187.33.247.110","192.168.0.112","TLSv1.3","695","Application Data, Application Data"
"408","8.574820","187.33.247.110","192.168.0.112","TCP","60","443  >  57963 [ACK] Seq=3304 Ack=1153 Win=67840 Len=0"
"409","8.574820","187.33.247.110","192.168.0.112","TLSv1.3","695","Application Data, Application Data"
"410","8.604572","192.168.0.112","187.33.247.110","TCP","54","57964  >  443 [ACK] Seq=1147 Ack=3945 Win=131584 Len=0"
"412","8.619447","192.168.0.112","187.33.247.110","TCP","54","57963  >  443 [ACK] Seq=1153 Ack=3945 Win=131584 Len=0"
"413","8.623300","192.168.0.112","187.33.247.110","TLSv1.3","1677","Application Data"
"414","8.626640","192.168.0.112","187.33.247.110","TLSv1.3","1538","Application Data"
"416","8.642211","187.33.247.110","192.168.0.112","TCP","60","443  >  57963 [ACK] Seq=3945 Ack=2776 Win=71168 Len=0"
"417","8.643347","187.33.247.110","192.168.0.112","TLSv1.3","1494","Application Data, Application Data"
"418","8.643347","187.33.247.110","192.168.0.112","TLSv1.3","943","Application Data"
"419","8.643540","192.168.0.112","187.33.247.110","TCP","54","57963  >  443 [ACK] Seq=2776 Ack=6274 Win=132352 Len=0"
"420","8.645224","187.33.247.110","192.168.0.112","TCP","60","443  >  57964 [ACK] Seq=3945 Ack=2631 Win=70912 Len=0"
"459","8.721506","187.33.247.110","192.168.0.112","TLSv1.3","1494","Application Data"
"460","8.722537","187.33.247.110","192.168.0.112","TCP","1494","443  >  57964 [ACK] Seq=5385 Ack=2631 Win=70912 Len=1440 [TCP segment of a reassembled PDU]"
"461","8.722537","187.33.247.110","192.168.0.112","TCP","1494","443  >  57964 [ACK] Seq=6825 Ack=2631 Win=70912 Len=1440 [TCP segment of a reassembled PDU]"
"462","8.722537","187.33.247.110","192.168.0.112","TCP","1494","443  >  57964 [ACK] Seq=8265 Ack=2631 Win=70912 Len=1440 [TCP segment of a reassembled PDU]"
"463","8.722537","187.33.247.110","192.168.0.112","TCP","1494","443  >  57964 [ACK] Seq=9705 Ack=2631 Win=70912 Len=1440 [TCP segment of a reassembled PDU]"
"464","8.722537","187.33.247.110","192.168.0.112","TCP","1494","443  >  57964 [ACK] Seq=11145 Ack=2631 Win=70912 Len=1440 [TCP segment of a reassembled PDU]"
"465","8.722537","187.33.247.110","192.168.0.112","TCP","1494","443  >  57964 [ACK] Seq=12585 Ack=2631 Win=70912 Len=1440 [TCP segment of a reassembled PDU]"
"466","8.722537","187.33.247.110","192.168.0.112","TCP","1494","443  >  57964 [ACK] Seq=14025 Ack=2631 Win=70912 Len=1440 [TCP segment of a reassembled PDU]"
"467","8.722598","192.168.0.112","187.33.247.110","TCP","54","57964  >  443 [ACK] Seq=2631 Ack=15465 Win=132352 Len=0"
"468","8.725866","187.33.247.110","192.168.0.112","TCP","1494","443  >  57964 [ACK] Seq=15465 Ack=2631 Win=70912 Len=1440 [TCP segment of a reassembled PDU]"
"469","8.725866","187.33.247.110","192.168.0.112","TCP","1494","443  >  57964 [ACK] Seq=16905 Ack=2631 Win=70912 Len=1440 [TCP segment of a reassembled PDU]"
"470","8.725866","187.33.247.110","192.168.0.112","TCP","1494","443  >  57964 [ACK] Seq=18345 Ack=2631 Win=70912 Len=1440 [TCP segment of a reassembled PDU]"
"471","8.725866","187.33.247.110","192.168.0.112","TCP","1494","443  >  57964 [ACK] Seq=19785 Ack=2631 Win=70912 Len=1440 [TCP segment of a reassembled PDU]"
"472","8.725866","187.33.247.110","192.168.0.112","TLSv1.3","1494","Application Data [TCP segment of a reassembled PDU]"
"473","8.725866","187.33.247.110","192.168.0.112","TCP","1494","443  >  57964 [ACK] Seq=22665 Ack=2631 Win=70912 Len=1440 [TCP segment of a reassembled PDU]"
"474","8.728321","187.33.247.110","192.168.0.112","TCP","1494","443  >  57964 [ACK] Seq=24105 Ack=2631 Win=70912 Len=1440 [TCP segment of a reassembled PDU]"
"475","8.728321","187.33.247.110","192.168.0.112","TCP","1494","443  >  57964 [ACK] Seq=25545 Ack=2631 Win=70912 Len=1440 [TCP segment of a reassembled PDU]"
"476","8.728321","187.33.247.110","192.168.0.112","TCP","1494","443  >  57964 [ACK] Seq=26985 Ack=2631 Win=70912 Len=1440 [TCP segment of a reassembled PDU]"
"477","8.728321","187.33.247.110","192.168.0.112","TCP","1494","443  >  57964 [ACK] Seq=28425 Ack=2631 Win=70912 Len=1440 [TCP segment of a reassembled PDU]"
"478","8.728498","192.168.0.112","187.33.247.110","TCP","54","57964  >  443 [ACK] Seq=2631 Ack=29865 Win=132352 Len=0"
"479","8.729547","187.33.247.110","192.168.0.112","TCP","1494","443  >  57964 [ACK] Seq=29865 Ack=2631 Win=70912 Len=1440 [TCP segment of a reassembled PDU]"
"480","8.729547","187.33.247.110","192.168.0.112","TCP","1494","443  >  57964 [ACK] Seq=31305 Ack=2631 Win=70912 Len=1440 [TCP segment of a reassembled PDU]"
"481","8.729547","187.33.247.110","192.168.0.112","TCP","1494","443  >  57964 [ACK] Seq=32745 Ack=2631 Win=70912 Len=1440 [TCP segment of a reassembled PDU]"
"482","8.730822","187.33.247.110","192.168.0.112","TCP","1494","443  >  57964 [ACK] Seq=34185 Ack=2631 Win=70912 Len=1440 [TCP segment of a reassembled PDU]"
"483","8.730822","187.33.247.110","192.168.0.112","TCP","1494","443  >  57964 [ACK] Seq=35625 Ack=2631 Win=70912 Len=1440 [TCP segment of a reassembled PDU]"
"484","8.730822","187.33.247.110","192.168.0.112","TLSv1.3","1494","Application Data [TCP segment of a reassembled PDU]"
"485","8.731011","192.168.0.112","187.33.247.110","TCP","54","57964  >  443 [ACK] Seq=2631 Ack=38505 Win=132352 Len=0"
"487","8.731877","187.33.247.110","192.168.0.112","TCP","1494","443  >  57964 [ACK] Seq=38505 Ack=2631 Win=70912 Len=1440 [TCP segment of a reassembled PDU]"
"488","8.731877","187.33.247.110","192.168.0.112","TCP","1494","443  >  57964 [ACK] Seq=39945 Ack=2631 Win=70912 Len=1440 [TCP segment of a reassembled PDU]"
"492","8.745165","187.33.247.110","192.168.0.112","TCP","1494","443  >  57964 [ACK] Seq=41385 Ack=2631 Win=70912 Len=1440 [TCP segment of a reassembled PDU]"
"493","8.745165","187.33.247.110","192.168.0.112","TCP","1494","443  >  57964 [ACK] Seq=42825 Ack=2631 Win=70912 Len=1440 [TCP segment of a reassembled PDU]"
"494","8.745165","187.33.247.110","192.168.0.112","TCP","1494","443  >  57964 [ACK] Seq=44265 Ack=2631 Win=70912 Len=1440 [TCP segment of a reassembled PDU]"
"495","8.745165","187.33.247.110","192.168.0.112","TCP","1494","443  >  57964 [ACK] Seq=45705 Ack=2631 Win=70912 Len=1440 [TCP segment of a reassembled PDU]"
"496","8.745165","187.33.247.110","192.168.0.112","TCP","1494","443  >  57964 [ACK] Seq=47145 Ack=2631 Win=70912 Len=1440 [TCP segment of a reassembled PDU]"
"497","8.745165","187.33.247.110","192.168.0.112","TCP","1494","443  >  57964 [ACK] Seq=48585 Ack=2631 Win=70912 Len=1440 [TCP segment of a reassembled PDU]"
"498","8.745304","192.168.0.112","187.33.247.110","TCP","54","57964  >  443 [ACK] Seq=2631 Ack=50025 Win=132352 Len=0"
"499","8.746336","187.33.247.110","192.168.0.112","TCP","1494","443  >  57964 [ACK] Seq=50025 Ack=2631 Win=70912 Len=1440 [TCP segment of a reassembled PDU]"
"500","8.746336","187.33.247.110","192.168.0.112","TCP","1494","443  >  57964 [ACK] Seq=51465 Ack=2631 Win=70912 Len=1440 [TCP segment of a reassembled PDU]"
"501","8.747484","187.33.247.110","192.168.0.112","TLSv1.3","1494","Application Data [TCP segment of a reassembled PDU]"
"502","8.747484","187.33.247.110","192.168.0.112","TCP","1494","443  >  57964 [ACK] Seq=54345 Ack=2631 Win=70912 Len=1440 [TCP segment of a reassembled PDU]"
"503","8.747616","192.168.0.112","187.33.247.110","TCP","54","57964  >  443 [ACK] Seq=2631 Ack=55785 Win=132352 Len=0"
"504","8.748658","187.33.247.110","192.168.0.112","TCP","1494","443  >  57964 [ACK] Seq=55785 Ack=2631 Win=70912 Len=1440 [TCP segment of a reassembled PDU]"
"505","8.748658","187.33.247.110","192.168.0.112","TCP","1494","443  >  57964 [ACK] Seq=57225 Ack=2631 Win=70912 Len=1440 [TCP segment of a reassembled PDU]"
"506","8.748658","187.33.247.110","192.168.0.112","TCP","1494","443  >  57964 [ACK] Seq=58665 Ack=2631 Win=70912 Len=1440 [TCP segment of a reassembled PDU]"
"507","8.748658","187.33.247.110","192.168.0.112","TCP","1494","443  >  57964 [ACK] Seq=60105 Ack=2631 Win=70912 Len=1440 [TCP segment of a reassembled PDU]"
"509","8.749734","187.33.247.110","192.168.0.112","TCP","1494","443  >  57964 [ACK] Seq=61545 Ack=2631 Win=70912 Len=1440 [TCP segment of a reassembled PDU]"
"510","8.749734","187.33.247.110","192.168.0.112","TCP","1494","443  >  57964 [ACK] Seq=62985 Ack=2631 Win=70912 Len=1440 [TCP segment of a reassembled PDU]"
"511","8.749843","192.168.0.112","187.33.247.110","TCP","54","57964  >  443 [ACK] Seq=2631 Ack=64425 Win=132352 Len=0"
"514","8.750798","187.33.247.110","192.168.0.112","TCP","1494","443  >  57964 [ACK] Seq=64425 Ack=2631 Win=70912 Len=1440 [TCP segment of a reassembled PDU]"
"515","8.750798","187.33.247.110","192.168.0.112","TCP","1494","443  >  57964 [ACK] Seq=65865 Ack=2631 Win=70912 Len=1440 [TCP segment of a reassembled PDU]"
"516","8.751779","187.33.247.110","192.168.0.112","TCP","1494","443  >  57964 [ACK] Seq=67305 Ack=2631 Win=70912 Len=1440 [TCP segment of a reassembled PDU]"
"517","8.751779","187.33.247.110","192.168.0.112","TCP","1494","443  >  57964 [ACK] Seq=68745 Ack=2631 Win=70912 Len=1440 [TCP segment of a reassembled PDU]"
"518","8.751876","192.168.0.112","187.33.247.110","TCP","54","57964  >  443 [ACK] Seq=2631 Ack=70185 Win=132352 Len=0"
"519","8.752752","187.33.247.110","192.168.0.112","TLSv1.3","1494","Application Data [TCP segment of a reassembled PDU]"
"520","8.752752","187.33.247.110","192.168.0.112","TLSv1.3","69","Application Data"
"521","8.752798","192.168.0.112","187.33.247.110","TCP","54","57964  >  443 [ACK] Seq=2631 Ack=71640 Win=132352 Len=0"
"1574","10.255656","192.168.0.112","187.33.247.110","TLSv1.3","1662","Application Data"
"1580","10.277325","187.33.247.110","192.168.0.112","TCP","60","443  >  57964 [ACK] Seq=71640 Ack=4239 Win=73984 Len=0"
"1610","10.497682","187.33.247.110","192.168.0.112","TLSv1.3","1494","Application Data, Application Data"
"1611","10.498861","187.33.247.110","192.168.0.112","TLSv1.3","1471","Application Data"
"1612","10.499036","192.168.0.112","187.33.247.110","TCP","54","57964  >  443 [ACK] Seq=4239 Ack=74497 Win=132352 Len=0"
"1620","10.609872","192.168.0.112","187.33.247.110","TLSv1.3","1546","Application Data"
"1621","10.635421","187.33.247.110","192.168.0.112","TCP","60","443  >  57964 [ACK] Seq=74497 Ack=5731 Win=77056 Len=0"
"1622","10.635421","187.33.247.110","192.168.0.112","TLSv1.3","1494","Application Data"
"1623","10.635421","187.33.247.110","192.168.0.112","TCP","1494","443  >  57964 [ACK] Seq=75937 Ack=5731 Win=77056 Len=1440 [TCP segment of a reassembled PDU]"
"1624","10.635421","187.33.247.110","192.168.0.112","TCP","1494","443  >  57964 [ACK] Seq=77377 Ack=5731 Win=77056 Len=1440 [TCP segment of a reassembled PDU]"
"1625","10.635421","187.33.247.110","192.168.0.112","TCP","1494","443  >  57964 [ACK] Seq=78817 Ack=5731 Win=77056 Len=1440 [TCP segment of a reassembled PDU]"
"1626","10.635421","187.33.247.110","192.168.0.112","TCP","1494","443  >  57964 [ACK] Seq=80257 Ack=5731 Win=77056 Len=1440 [TCP segment of a reassembled PDU]"
"1627","10.635421","187.33.247.110","192.168.0.112","TCP","1494","443  >  57964 [ACK] Seq=81697 Ack=5731 Win=77056 Len=1440 [TCP segment of a reassembled PDU]"
"1628","10.635421","187.33.247.110","192.168.0.112","TCP","1494","443  >  57964 [ACK] Seq=83137 Ack=5731 Win=77056 Len=1440 [TCP segment of a reassembled PDU]"
"1629","10.635421","187.33.247.110","192.168.0.112","TCP","1494","443  >  57964 [ACK] Seq=84577 Ack=5731 Win=77056 Len=1440 [TCP segment of a reassembled PDU]"
"1630","10.635421","187.33.247.110","192.168.0.112","TCP","1494","443  >  57964 [ACK] Seq=86017 Ack=5731 Win=77056 Len=1440 [TCP segment of a reassembled PDU]"
"1631","10.636435","187.33.247.110","192.168.0.112","TCP","1494","443  >  57964 [ACK] Seq=87457 Ack=5731 Win=77056 Len=1440 [TCP segment of a reassembled PDU]"
"1632","10.636435","187.33.247.110","192.168.0.112","TCP","1494","443  >  57964 [ACK] Seq=88897 Ack=5731 Win=77056 Len=1440 [TCP segment of a reassembled PDU]"
"1633","10.636435","187.33.247.110","192.168.0.112","TCP","1494","443  >  57964 [ACK] Seq=90337 Ack=5731 Win=77056 Len=1440 [TCP segment of a reassembled PDU]"
"1634","10.636435","187.33.247.110","192.168.0.112","TLSv1.3","1494","Application Data [TCP segment of a reassembled PDU]"
"1635","10.636435","187.33.247.110","192.168.0.112","TCP","1494","443  >  57964 [ACK] Seq=93217 Ack=5731 Win=77056 Len=1440 [TCP segment of a reassembled PDU]"
"1636","10.636435","187.33.247.110","192.168.0.112","TCP","1494","443  >  57964 [ACK] Seq=94657 Ack=5731 Win=77056 Len=1440 [TCP segment of a reassembled PDU]"
"1637","10.636435","187.33.247.110","192.168.0.112","TCP","1494","443  >  57964 [ACK] Seq=96097 Ack=5731 Win=77056 Len=1440 [TCP segment of a reassembled PDU]"
"1638","10.636435","187.33.247.110","192.168.0.112","TCP","1494","443  >  57964 [ACK] Seq=97537 Ack=5731 Win=77056 Len=1440 [TCP segment of a reassembled PDU]"
"1639","10.636435","187.33.247.110","192.168.0.112","TCP","1494","443  >  57964 [ACK] Seq=98977 Ack=5731 Win=77056 Len=1440 [TCP segment of a reassembled PDU]"
"1640","10.636513","192.168.0.112","187.33.247.110","TCP","54","57964  >  443 [ACK] Seq=5731 Ack=100417 Win=132352 Len=0"
"1641","10.637430","187.33.247.110","192.168.0.112","TCP","1494","443  >  57964 [ACK] Seq=100417 Ack=5731 Win=77056 Len=1440 [TCP segment of a reassembled PDU]"
"1642","10.637430","187.33.247.110","192.168.0.112","TCP","1494","443  >  57964 [ACK] Seq=101857 Ack=5731 Win=77056 Len=1440 [TCP segment of a reassembled PDU]"
"1643","10.637430","187.33.247.110","192.168.0.112","TCP","1494","443  >  57964 [ACK] Seq=103297 Ack=5731 Win=77056 Len=1440 [TCP segment of a reassembled PDU]"
"1644","10.638342","187.33.247.110","192.168.0.112","TCP","1494","443  >  57964 [ACK] Seq=104737 Ack=5731 Win=77056 Len=1440 [TCP segment of a reassembled PDU]"
"1645","10.638342","187.33.247.110","192.168.0.112","TCP","1494","443  >  57964 [ACK] Seq=106177 Ack=5731 Win=77056 Len=1440 [TCP segment of a reassembled PDU]"
"1646","10.638342","187.33.247.110","192.168.0.112","TLSv1.3","1494","Application Data [TCP segment of a reassembled PDU]"
"1647","10.638411","192.168.0.112","187.33.247.110","TCP","54","57964  >  443 [ACK] Seq=5731 Ack=109057 Win=132352 Len=0"
"1648","10.639249","187.33.247.110","192.168.0.112","TCP","1494","443  >  57964 [ACK] Seq=109057 Ack=5731 Win=77056 Len=1440 [TCP segment of a reassembled PDU]"
"1649","10.639249","187.33.247.110","192.168.0.112","TCP","1494","443  >  57964 [ACK] Seq=110497 Ack=5731 Win=77056 Len=1440 [TCP segment of a reassembled PDU]"
"1650","10.639249","187.33.247.110","192.168.0.112","TCP","1494","443  >  57964 [ACK] Seq=111937 Ack=5731 Win=77056 Len=1440 [TCP segment of a reassembled PDU]"
"1651","10.640118","187.33.247.110","192.168.0.112","TCP","1494","443  >  57964 [ACK] Seq=113377 Ack=5731 Win=77056 Len=1440 [TCP segment of a reassembled PDU]"
"1652","10.640118","187.33.247.110","192.168.0.112","TCP","1494","443  >  57964 [ACK] Seq=114817 Ack=5731 Win=77056 Len=1440 [TCP segment of a reassembled PDU]"
"1653","10.640118","187.33.247.110","192.168.0.112","TCP","1494","443  >  57964 [ACK] Seq=116257 Ack=5731 Win=77056 Len=1440 [TCP segment of a reassembled PDU]"
"1654","10.640222","192.168.0.112","187.33.247.110","TCP","54","57964  >  443 [ACK] Seq=5731 Ack=117697 Win=132352 Len=0"
"1655","10.645771","187.33.247.110","192.168.0.112","TCP","1494","443  >  57964 [ACK] Seq=117697 Ack=5731 Win=77056 Len=1440 [TCP segment of a reassembled PDU]"
"1656","10.645771","187.33.247.110","192.168.0.112","TCP","1494","443  >  57964 [ACK] Seq=119137 Ack=5731 Win=77056 Len=1440 [TCP segment of a reassembled PDU]"
"1657","10.645771","187.33.247.110","192.168.0.112","TCP","1494","443  >  57964 [ACK] Seq=120577 Ack=5731 Win=77056 Len=1440 [TCP segment of a reassembled PDU]"
"1658","10.645771","187.33.247.110","192.168.0.112","TCP","1494","443  >  57964 [ACK] Seq=122017 Ack=5731 Win=77056 Len=1440 [TCP segment of a reassembled PDU]"
"1659","10.645771","187.33.247.110","192.168.0.112","TLSv1.3","1494","Application Data [TCP segment of a reassembled PDU]"
"1660","10.645771","187.33.247.110","192.168.0.112","TCP","1494","443  >  57964 [ACK] Seq=124897 Ack=5731 Win=77056 Len=1440 [TCP segment of a reassembled PDU]"
"1661","10.645771","187.33.247.110","192.168.0.112","TCP","1494","443  >  57964 [ACK] Seq=126337 Ack=5731 Win=77056 Len=1440 [TCP segment of a reassembled PDU]"
"1662","10.645771","187.33.247.110","192.168.0.112","TCP","1494","443  >  57964 [ACK] Seq=127777 Ack=5731 Win=77056 Len=1440 [TCP segment of a reassembled PDU]"
"1663","10.645771","187.33.247.110","192.168.0.112","TCP","1494","443  >  57964 [ACK] Seq=129217 Ack=5731 Win=77056 Len=1440 [TCP segment of a reassembled PDU]"
"1664","10.645771","187.33.247.110","192.168.0.112","TCP","1494","443  >  57964 [ACK] Seq=130657 Ack=5731 Win=77056 Len=1440 [TCP segment of a reassembled PDU]"
"1665","10.648483","187.33.247.110","192.168.0.112","TCP","1494","443  >  57964 [ACK] Seq=132097 Ack=5731 Win=77056 Len=1440 [TCP segment of a reassembled PDU]"
"1666","10.648483","187.33.247.110","192.168.0.112","TCP","1494","443  >  57964 [ACK] Seq=133537 Ack=5731 Win=77056 Len=1440 [TCP segment of a reassembled PDU]"
"1667","10.648483","187.33.247.110","192.168.0.112","TCP","1494","443  >  57964 [ACK] Seq=134977 Ack=5731 Win=77056 Len=1440 [TCP segment of a reassembled PDU]"
"1668","10.648483","187.33.247.110","192.168.0.112","TCP","1494","443  >  57964 [ACK] Seq=136417 Ack=5731 Win=77056 Len=1440 [TCP segment of a reassembled PDU]"
"1669","10.648483","187.33.247.110","192.168.0.112","TCP","1494","443  >  57964 [ACK] Seq=137857 Ack=5731 Win=77056 Len=1440 [TCP segment of a reassembled PDU]"
"1670","10.648483","187.33.247.110","192.168.0.112","TCP","1494","443  >  57964 [ACK] Seq=139297 Ack=5731 Win=77056 Len=1440 [TCP segment of a reassembled PDU]"
"1671","10.648483","187.33.247.110","192.168.0.112","TLSv1.3","578","Application Data"
"1672","10.648746","192.168.0.112","187.33.247.110","TCP","54","57964  >  443 [ACK] Seq=5731 Ack=141261 Win=132352 Len=0"
"1674","10.704301","192.168.0.112","187.33.247.110","TLSv1.3","1547","Application Data"
"1677","10.724964","187.33.247.110","192.168.0.112","TCP","60","443  >  57964 [ACK] Seq=141261 Ack=7224 Win=80128 Len=0"
"1679","10.760368","187.33.247.110","192.168.0.112","TLSv1.3","1494","Application Data"
"1680","10.760368","187.33.247.110","192.168.0.112","TCP","1494","443  >  57964 [ACK] Seq=142701 Ack=7224 Win=80128 Len=1440 [TCP segment of a reassembled PDU]"
"1681","10.760368","187.33.247.110","192.168.0.112","TCP","1494","443  >  57964 [ACK] Seq=144141 Ack=7224 Win=80128 Len=1440 [TCP segment of a reassembled PDU]"
"1682","10.760368","187.33.247.110","192.168.0.112","TCP","1494","443  >  57964 [ACK] Seq=145581 Ack=7224 Win=80128 Len=1440 [TCP segment of a reassembled PDU]"
"1683","10.760368","187.33.247.110","192.168.0.112","TCP","1494","443  >  57964 [ACK] Seq=147021 Ack=7224 Win=80128 Len=1440 [TCP segment of a reassembled PDU]"
"1684","10.760368","187.33.247.110","192.168.0.112","TCP","1494","443  >  57964 [ACK] Seq=148461 Ack=7224 Win=80128 Len=1440 [TCP segment of a reassembled PDU]"
"1685","10.760368","187.33.247.110","192.168.0.112","TCP","1494","443  >  57964 [ACK] Seq=149901 Ack=7224 Win=80128 Len=1440 [TCP segment of a reassembled PDU]"
"1686","10.760368","187.33.247.110","192.168.0.112","TCP","1494","443  >  57964 [ACK] Seq=151341 Ack=7224 Win=80128 Len=1440 [TCP segment of a reassembled PDU]"
"1687","10.760368","187.33.247.110","192.168.0.112","TCP","1494","443  >  57964 [ACK] Seq=152781 Ack=7224 Win=80128 Len=1440 [TCP segment of a reassembled PDU]"
"1688","10.763217","187.33.247.110","192.168.0.112","TCP","1494","443  >  57964 [ACK] Seq=154221 Ack=7224 Win=80128 Len=1440 [TCP segment of a reassembled PDU]"
"1689","10.763217","187.33.247.110","192.168.0.112","TCP","1494","443  >  57964 [ACK] Seq=155661 Ack=7224 Win=80128 Len=1440 [TCP segment of a reassembled PDU]"
"1690","10.763217","187.33.247.110","192.168.0.112","TCP","1494","443  >  57964 [ACK] Seq=157101 Ack=7224 Win=80128 Len=1440 [TCP segment of a reassembled PDU]"
"1692","10.763217","187.33.247.110","192.168.0.112","TLSv1.3","1494","Application Data [TCP segment of a reassembled PDU]"
"1693","10.763217","187.33.247.110","192.168.0.112","TCP","1494","443  >  57964 [ACK] Seq=159981 Ack=7224 Win=80128 Len=1440 [TCP segment of a reassembled PDU]"
"1694","10.763217","187.33.247.110","192.168.0.112","TCP","1494","443  >  57964 [ACK] Seq=161421 Ack=7224 Win=80128 Len=1440 [TCP segment of a reassembled PDU]"
"1695","10.763217","187.33.247.110","192.168.0.112","TCP","1494","443  >  57964 [ACK] Seq=162861 Ack=7224 Win=80128 Len=1440 [TCP segment of a reassembled PDU]"
"1696","10.763217","187.33.247.110","192.168.0.112","TCP","1494","443  >  57964 [ACK] Seq=164301 Ack=7224 Win=80128 Len=1440 [TCP segment of a reassembled PDU]"
"1697","10.763217","187.33.247.110","192.168.0.112","TCP","1494","443  >  57964 [ACK] Seq=165741 Ack=7224 Win=80128 Len=1440 [TCP segment of a reassembled PDU]"
"1698","10.763307","192.168.0.112","187.33.247.110","TCP","54","57964  >  443 [ACK] Seq=7224 Ack=158541 Win=132352 Len=0"
"1699","10.763578","187.33.247.110","192.168.0.112","TCP","1494","443  >  57964 [ACK] Seq=167181 Ack=7224 Win=80128 Len=1440 [TCP segment of a reassembled PDU]"
"1700","10.763578","187.33.247.110","192.168.0.112","TCP","1494","443  >  57964 [ACK] Seq=168621 Ack=7224 Win=80128 Len=1440 [TCP segment of a reassembled PDU]"
"1701","10.763578","187.33.247.110","192.168.0.112","TCP","1494","443  >  57964 [ACK] Seq=170061 Ack=7224 Win=80128 Len=1440 [TCP segment of a reassembled PDU]"
"1702","10.763653","192.168.0.112","187.33.247.110","TCP","54","57964  >  443 [ACK] Seq=7224 Ack=171501 Win=132352 Len=0"
"1703","10.764537","187.33.247.110","192.168.0.112","TCP","1494","443  >  57964 [ACK] Seq=171501 Ack=7224 Win=80128 Len=1440 [TCP segment of a reassembled PDU]"
"1704","10.764537","187.33.247.110","192.168.0.112","TCP","1494","443  >  57964 [ACK] Seq=172941 Ack=7224 Win=80128 Len=1440 [TCP segment of a reassembled PDU]"
"1705","10.764537","187.33.247.110","192.168.0.112","TLSv1.3","1494","Application Data [TCP segment of a reassembled PDU]"
"1706","10.764537","187.33.247.110","192.168.0.112","TCP","1494","443  >  57964 [ACK] Seq=175821 Ack=7224 Win=80128 Len=1440 [TCP segment of a reassembled PDU]"
"1707","10.765473","187.33.247.110","192.168.0.112","TCP","1494","443  >  57964 [ACK] Seq=177261 Ack=7224 Win=80128 Len=1440 [TCP segment of a reassembled PDU]"
"1708","10.765473","187.33.247.110","192.168.0.112","TCP","1494","443  >  57964 [ACK] Seq=178701 Ack=7224 Win=80128 Len=1440 [TCP segment of a reassembled PDU]"
"1709","10.765473","187.33.247.110","192.168.0.112","TCP","1494","443  >  57964 [ACK] Seq=180141 Ack=7224 Win=80128 Len=1440 [TCP segment of a reassembled PDU]"
"1710","10.765473","187.33.247.110","192.168.0.112","TCP","1494","443  >  57964 [ACK] Seq=181581 Ack=7224 Win=80128 Len=1440 [TCP segment of a reassembled PDU]"
"1711","10.765606","192.168.0.112","187.33.247.110","TCP","54","57964  >  443 [ACK] Seq=7224 Ack=183021 Win=132352 Len=0"
"1712","10.766586","187.33.247.110","192.168.0.112","TCP","1494","443  >  57964 [ACK] Seq=183021 Ack=7224 Win=80128 Len=1440 [TCP segment of a reassembled PDU]"
"1713","10.766586","187.33.247.110","192.168.0.112","TCP","1494","443  >  57964 [ACK] Seq=184461 Ack=7224 Win=80128 Len=1440 [TCP segment of a reassembled PDU]"
"1714","10.766586","187.33.247.110","192.168.0.112","TCP","1494","443  >  57964 [ACK] Seq=185901 Ack=7224 Win=80128 Len=1440 [TCP segment of a reassembled PDU]"
"1715","10.766586","187.33.247.110","192.168.0.112","TCP","1494","443  >  57964 [ACK] Seq=187341 Ack=7224 Win=80128 Len=1440 [TCP segment of a reassembled PDU]"
"1717","10.767551","187.33.247.110","192.168.0.112","TCP","1494","443  >  57964 [ACK] Seq=188781 Ack=7224 Win=80128 Len=1440 [TCP segment of a reassembled PDU]"
"1718","10.767551","187.33.247.110","192.168.0.112","TLSv1.3","1494","Application Data [TCP segment of a reassembled PDU]"
"1719","10.767551","187.33.247.110","192.168.0.112","TCP","1494","443  >  57964 [ACK] Seq=191661 Ack=7224 Win=80128 Len=1440 [TCP segment of a reassembled PDU]"
"1720","10.767597","192.168.0.112","187.33.247.110","TCP","54","57964  >  443 [ACK] Seq=7224 Ack=193101 Win=132352 Len=0"
"1721","10.768430","187.33.247.110","192.168.0.112","TCP","1494","443  >  57964 [ACK] Seq=193101 Ack=7224 Win=80128 Len=1440 [TCP segment of a reassembled PDU]"
"1722","10.768430","187.33.247.110","192.168.0.112","TCP","1494","443  >  57964 [ACK] Seq=194541 Ack=7224 Win=80128 Len=1440 [TCP segment of a reassembled PDU]"
"1723","10.768430","187.33.247.110","192.168.0.112","TCP","1494","443  >  57964 [ACK] Seq=195981 Ack=7224 Win=80128 Len=1440 [TCP segment of a reassembled PDU]"
"1724","10.768430","187.33.247.110","192.168.0.112","TCP","1494","443  >  57964 [ACK] Seq=197421 Ack=7224 Win=80128 Len=1440 [TCP segment of a reassembled PDU]"
"1725","10.769407","187.33.247.110","192.168.0.112","TCP","1494","443  >  57964 [ACK] Seq=198861 Ack=7224 Win=80128 Len=1440 [TCP segment of a reassembled PDU]"
"1726","10.769407","187.33.247.110","192.168.0.112","TCP","1494","443  >  57964 [ACK] Seq=200301 Ack=7224 Win=80128 Len=1440 [TCP segment of a reassembled PDU]"
"1727","10.769407","187.33.247.110","192.168.0.112","TCP","1494","443  >  57964 [ACK] Seq=201741 Ack=7224 Win=80128 Len=1440 [TCP segment of a reassembled PDU]"
"1728","10.769407","187.33.247.110","192.168.0.112","TCP","1494","443  >  57964 [ACK] Seq=203181 Ack=7224 Win=80128 Len=1440 [TCP segment of a reassembled PDU]"
"1729","10.769461","192.168.0.112","187.33.247.110","TCP","54","57964  >  443 [ACK] Seq=7224 Ack=204621 Win=132352 Len=0"
"1730","10.770275","187.33.247.110","192.168.0.112","TCP","1494","443  >  57964 [ACK] Seq=204621 Ack=7224 Win=80128 Len=1440 [TCP segment of a reassembled PDU]"
"1731","10.770275","187.33.247.110","192.168.0.112","TCP","1494","443  >  57964 [ACK] Seq=206061 Ack=7224 Win=80128 Len=1440 [TCP segment of a reassembled PDU]"
"1732","10.770275","187.33.247.110","192.168.0.112","TLSv1.3","1494","Application Data [TCP segment of a reassembled PDU]"
"1733","10.770275","187.33.247.110","192.168.0.112","TCP","1494","443  >  57964 [ACK] Seq=208941 Ack=7224 Win=80128 Len=1440 [TCP segment of a reassembled PDU]"
"1734","10.771072","187.33.247.110","192.168.0.112","TCP","1494","443  >  57964 [ACK] Seq=210381 Ack=7224 Win=80128 Len=1440 [TCP segment of a reassembled PDU]"
"1735","10.771072","187.33.247.110","192.168.0.112","TCP","1494","443  >  57964 [ACK] Seq=211821 Ack=7224 Win=80128 Len=1440 [TCP segment of a reassembled PDU]"
"1736","10.771072","187.33.247.110","192.168.0.112","TCP","1494","443  >  57964 [ACK] Seq=213261 Ack=7224 Win=80128 Len=1440 [TCP segment of a reassembled PDU]"
"1737","10.771092","192.168.0.112","187.33.247.110","TCP","54","57964  >  443 [ACK] Seq=7224 Ack=214701 Win=132352 Len=0"
"1738","10.771874","187.33.247.110","192.168.0.112","TCP","1494","443  >  57964 [ACK] Seq=214701 Ack=7224 Win=80128 Len=1440 [TCP segment of a reassembled PDU]"
"1739","10.771874","187.33.247.110","192.168.0.112","TCP","1494","443  >  57964 [ACK] Seq=216141 Ack=7224 Win=80128 Len=1440 [TCP segment of a reassembled PDU]"
"1740","10.771874","187.33.247.110","192.168.0.112","TCP","1494","443  >  57964 [PSH, ACK] Seq=217581 Ack=7224 Win=80128 Len=1440 [TCP segment of a reassembled PDU]"
"1741","10.772665","187.33.247.110","192.168.0.112","TCP","1494","443  >  57964 [ACK] Seq=219021 Ack=7224 Win=80128 Len=1440 [TCP segment of a reassembled PDU]"
"1742","10.772665","187.33.247.110","192.168.0.112","TCP","1494","443  >  57964 [ACK] Seq=220461 Ack=7224 Win=80128 Len=1440 [TCP segment of a reassembled PDU]"
"1743","10.772665","187.33.247.110","192.168.0.112","TCP","1494","443  >  57964 [ACK] Seq=221901 Ack=7224 Win=80128 Len=1440 [TCP segment of a reassembled PDU]"
"1744","10.772681","192.168.0.112","187.33.247.110","TCP","54","57964  >  443 [ACK] Seq=7224 Ack=223341 Win=132352 Len=0"
"1745","10.773465","187.33.247.110","192.168.0.112","TLSv1.3","1494","Application Data [TCP segment of a reassembled PDU]"
"1746","10.773465","187.33.247.110","192.168.0.112","TCP","1494","443  >  57964 [ACK] Seq=224781 Ack=7224 Win=80128 Len=1440 [TCP segment of a reassembled PDU]"
"1747","10.773465","187.33.247.110","192.168.0.112","TCP","1494","443  >  57964 [ACK] Seq=226221 Ack=7224 Win=80128 Len=1440 [TCP segment of a reassembled PDU]"
"1748","10.774318","187.33.247.110","192.168.0.112","TCP","1494","443  >  57964 [ACK] Seq=227661 Ack=7224 Win=80128 Len=1440 [TCP segment of a reassembled PDU]"
"1749","10.774318","187.33.247.110","192.168.0.112","TCP","1494","443  >  57964 [ACK] Seq=229101 Ack=7224 Win=80128 Len=1440 [TCP segment of a reassembled PDU]"
"1750","10.774318","187.33.247.110","192.168.0.112","TCP","1494","443  >  57964 [ACK] Seq=230541 Ack=7224 Win=80128 Len=1440 [TCP segment of a reassembled PDU]"
"1751","10.774456","192.168.0.112","187.33.247.110","TCP","54","57964  >  443 [ACK] Seq=7224 Ack=231981 Win=132352 Len=0"
"1752","10.775915","187.33.247.110","192.168.0.112","TCP","1494","443  >  57964 [ACK] Seq=231981 Ack=7224 Win=80128 Len=1440 [TCP segment of a reassembled PDU]"
"1753","10.775915","187.33.247.110","192.168.0.112","TCP","1494","443  >  57964 [ACK] Seq=233421 Ack=7224 Win=80128 Len=1440 [TCP segment of a reassembled PDU]"
"1754","10.775915","187.33.247.110","192.168.0.112","TCP","1494","443  >  57964 [ACK] Seq=234861 Ack=7224 Win=80128 Len=1440 [TCP segment of a reassembled PDU]"
"1755","10.775915","187.33.247.110","192.168.0.112","TCP","1494","443  >  57964 [ACK] Seq=236301 Ack=7224 Win=80128 Len=1440 [TCP segment of a reassembled PDU]"
"1756","10.777068","187.33.247.110","192.168.0.112","TCP","1494","443  >  57964 [ACK] Seq=237741 Ack=7224 Win=80128 Len=1440 [TCP segment of a reassembled PDU]"
"1757","10.777068","187.33.247.110","192.168.0.112","TCP","1494","443  >  57964 [ACK] Seq=239181 Ack=7224 Win=80128 Len=1440 [TCP segment of a reassembled PDU]"
"1758","10.777068","187.33.247.110","192.168.0.112","TLSv1.3","1494","Application Data [TCP segment of a reassembled PDU]"
"1759","10.777068","187.33.247.110","192.168.0.112","TCP","1494","443  >  57964 [ACK] Seq=242061 Ack=7224 Win=80128 Len=1440 [TCP segment of a reassembled PDU]"
"1760","10.777068","187.33.247.110","192.168.0.112","TCP","1494","443  >  57964 [ACK] Seq=243501 Ack=7224 Win=80128 Len=1440 [TCP segment of a reassembled PDU]"
"1761","10.777213","192.168.0.112","187.33.247.110","TCP","54","57964  >  443 [ACK] Seq=7224 Ack=244941 Win=132352 Len=0"
"1763","10.778394","187.33.247.110","192.168.0.112","TCP","1494","443  >  57964 [ACK] Seq=244941 Ack=7224 Win=80128 Len=1440 [TCP segment of a reassembled PDU]"
"1764","10.778394","187.33.247.110","192.168.0.112","TCP","1494","443  >  57964 [ACK] Seq=246381 Ack=7224 Win=80128 Len=1440 [TCP segment of a reassembled PDU]"
"1765","10.778394","187.33.247.110","192.168.0.112","TCP","1494","443  >  57964 [ACK] Seq=247821 Ack=7224 Win=80128 Len=1440 [TCP segment of a reassembled PDU]"
"1766","10.778394","187.33.247.110","192.168.0.112","TCP","1494","443  >  57964 [ACK] Seq=249261 Ack=7224 Win=80128 Len=1440 [TCP segment of a reassembled PDU]"
"1767","10.778394","187.33.247.110","192.168.0.112","TCP","1494","443  >  57964 [ACK] Seq=250701 Ack=7224 Win=80128 Len=1440 [TCP segment of a reassembled PDU]"
"1768","10.778394","187.33.247.110","192.168.0.112","TCP","1494","443  >  57964 [ACK] Seq=252141 Ack=7224 Win=80128 Len=1440 [TCP segment of a reassembled PDU]"
"1769","10.779384","187.33.247.110","192.168.0.112","TCP","1494","443  >  57964 [ACK] Seq=253581 Ack=7224 Win=80128 Len=1440 [TCP segment of a reassembled PDU]"
"1770","10.779384","187.33.247.110","192.168.0.112","TCP","1494","443  >  57964 [ACK] Seq=255021 Ack=7224 Win=80128 Len=1440 [TCP segment of a reassembled PDU]"
"1771","10.779384","187.33.247.110","192.168.0.112","TLSv1.3","1494","Application Data [TCP segment of a reassembled PDU]"
"1772","10.779470","192.168.0.112","187.33.247.110","TCP","54","57964  >  443 [ACK] Seq=7224 Ack=257901 Win=132352 Len=0"
"1773","10.780359","187.33.247.110","192.168.0.112","TCP","1494","443  >  57964 [ACK] Seq=257901 Ack=7224 Win=80128 Len=1440 [TCP segment of a reassembled PDU]"
"1774","10.780359","187.33.247.110","192.168.0.112","TCP","1494","443  >  57964 [ACK] Seq=259341 Ack=7224 Win=80128 Len=1440 [TCP segment of a reassembled PDU]"
"1775","10.780359","187.33.247.110","192.168.0.112","TCP","1494","443  >  57964 [ACK] Seq=260781 Ack=7224 Win=80128 Len=1440 [TCP segment of a reassembled PDU]"
"1776","10.780359","187.33.247.110","192.168.0.112","TCP","1494","443  >  57964 [ACK] Seq=262221 Ack=7224 Win=80128 Len=1440 [TCP segment of a reassembled PDU]"
"1777","10.781258","187.33.247.110","192.168.0.112","TCP","1494","443  >  57964 [ACK] Seq=263661 Ack=7224 Win=80128 Len=1440 [TCP segment of a reassembled PDU]"
"1778","10.781258","187.33.247.110","192.168.0.112","TCP","1494","443  >  57964 [ACK] Seq=265101 Ack=7224 Win=80128 Len=1440 [TCP segment of a reassembled PDU]"
"1779","10.781258","187.33.247.110","192.168.0.112","TCP","1494","443  >  57964 [ACK] Seq=266541 Ack=7224 Win=80128 Len=1440 [TCP segment of a reassembled PDU]"
"1780","10.781258","187.33.247.110","192.168.0.112","TCP","1494","443  >  57964 [ACK] Seq=267981 Ack=7224 Win=80128 Len=1440 [TCP segment of a reassembled PDU]"
"1781","10.781331","192.168.0.112","187.33.247.110","TCP","54","57964  >  443 [ACK] Seq=7224 Ack=269421 Win=132352 Len=0"
"1782","10.782357","187.33.247.110","192.168.0.112","TCP","1494","443  >  57964 [ACK] Seq=269421 Ack=7224 Win=80128 Len=1440 [TCP segment of a reassembled PDU]"
"1783","10.782357","187.33.247.110","192.168.0.112","TCP","1494","443  >  57964 [ACK] Seq=270861 Ack=7224 Win=80128 Len=1440 [TCP segment of a reassembled PDU]"
"1784","10.782357","187.33.247.110","192.168.0.112","TLSv1.3","1494","Application Data [TCP segment of a reassembled PDU]"
"1785","10.782357","187.33.247.110","192.168.0.112","TCP","1494","443  >  57964 [ACK] Seq=273741 Ack=7224 Win=80128 Len=1440 [TCP segment of a reassembled PDU]"
"1786","10.783202","187.33.247.110","192.168.0.112","TCP","1494","443  >  57964 [ACK] Seq=275181 Ack=7224 Win=80128 Len=1440 [TCP segment of a reassembled PDU]"
"1787","10.783202","187.33.247.110","192.168.0.112","TCP","1494","443  >  57964 [ACK] Seq=276621 Ack=7224 Win=80128 Len=1440 [TCP segment of a reassembled PDU]"
"1788","10.783202","187.33.247.110","192.168.0.112","TCP","1494","443  >  57964 [ACK] Seq=278061 Ack=7224 Win=80128 Len=1440 [TCP segment of a reassembled PDU]"
"1789","10.783232","192.168.0.112","187.33.247.110","TCP","54","57964  >  443 [ACK] Seq=7224 Ack=279501 Win=132352 Len=0"
"1790","10.784022","187.33.247.110","192.168.0.112","TCP","1494","443  >  57964 [ACK] Seq=279501 Ack=7224 Win=80128 Len=1440 [TCP segment of a reassembled PDU]"
"1791","10.784022","187.33.247.110","192.168.0.112","TCP","1494","443  >  57964 [ACK] Seq=280941 Ack=7224 Win=80128 Len=1440 [TCP segment of a reassembled PDU]"
"1792","10.784022","187.33.247.110","192.168.0.112","TCP","1494","443  >  57964 [PSH, ACK] Seq=282381 Ack=7224 Win=80128 Len=1440 [TCP segment of a reassembled PDU]"
"1793","10.784852","187.33.247.110","192.168.0.112","TCP","1494","443  >  57964 [ACK] Seq=283821 Ack=7224 Win=80128 Len=1440 [TCP segment of a reassembled PDU]"
"1794","10.784852","187.33.247.110","192.168.0.112","TCP","1494","443  >  57964 [ACK] Seq=285261 Ack=7224 Win=80128 Len=1440 [TCP segment of a reassembled PDU]"
"1795","10.784852","187.33.247.110","192.168.0.112","TCP","1494","443  >  57964 [ACK] Seq=286701 Ack=7224 Win=80128 Len=1440 [TCP segment of a reassembled PDU]"
"1796","10.784899","192.168.0.112","187.33.247.110","TCP","54","57964  >  443 [ACK] Seq=7224 Ack=288141 Win=132352 Len=0"
"1797","10.785703","187.33.247.110","192.168.0.112","TCP","1494","443  >  57964 [ACK] Seq=288141 Ack=7224 Win=80128 Len=1440 [TCP segment of a reassembled PDU]"
"1798","10.785703","187.33.247.110","192.168.0.112","TLSv1.3","1494","Application Data [TCP segment of a reassembled PDU]"
"1799","10.785703","187.33.247.110","192.168.0.112","TCP","1494","443  >  57964 [ACK] Seq=291021 Ack=7224 Win=80128 Len=1440 [TCP segment of a reassembled PDU]"
"1800","10.786570","187.33.247.110","192.168.0.112","TCP","1494","443  >  57964 [ACK] Seq=292461 Ack=7224 Win=80128 Len=1440 [TCP segment of a reassembled PDU]"
"1801","10.786570","187.33.247.110","192.168.0.112","TCP","1494","443  >  57964 [ACK] Seq=293901 Ack=7224 Win=80128 Len=1440 [TCP segment of a reassembled PDU]"
"1802","10.786570","187.33.247.110","192.168.0.112","TCP","1494","443  >  57964 [ACK] Seq=295341 Ack=7224 Win=80128 Len=1440 [TCP segment of a reassembled PDU]"
"1803","10.786587","192.168.0.112","187.33.247.110","TCP","54","57964  >  443 [ACK] Seq=7224 Ack=296781 Win=132352 Len=0"
"1804","10.787426","187.33.247.110","192.168.0.112","TCP","1494","443  >  57964 [ACK] Seq=296781 Ack=7224 Win=80128 Len=1440 [TCP segment of a reassembled PDU]"
"1805","10.787426","187.33.247.110","192.168.0.112","TLSv1.3","456","Application Data"
"1806","10.787444","192.168.0.112","187.33.247.110","TCP","54","57964  >  443 [ACK] Seq=7224 Ack=298623 Win=132352 Len=0"
